[
  {
    "relativePath": "2025/05/17/DSC_5354.jpg",
    "filename": "DSC_5354.jpg",
    "year": 2025,
    "month": 5,
    "day": 17,
    "slug": "2025-05-17-DSC_5354",
    "width": 6064,
    "height": 4040,
    "dateTaken": "2025-05-17T22:00:19",
    "title": "",
    "description": null,
    "tags": [
      "brussels",
      "dog",
      "event",
      "lgbt",
      "people",
      "portrait",
      "pride"
    ],
    "cameraModel": "NIKON Z 6_2",
    "lensModel": "NIKKOR Z 20mm f/1.8 S",
    "flash": false,
    "focalLength": 20.0,
    "apertureValue": 1.8,
    "isoSpeedRatings": 5000,
    "exposureTime": 0.00625,
    "creator": "Aleksandr Kadykov",
    "copyright": "Creative Commons Attribution (CC BY)"
  },
  {
    "relativePath": "2025/05/17/DSC_5349.jpg",
    "filename": "DSC_5349.jpg",
    "year": 2025,
    "month": 5,
    "day": 17,
    "slug": "2025-05-17-DSC_5349",
    "width": 4040,
    "height": 6064,
    "dateTaken": "2025-05-17T21:52:32",
    "title": "",
    "description": null,
    "tags": [
      "brussels",
      "event",
      "lgbt",
      "pride"
    ],
    "cameraModel": "NIKON Z 6_2",
    "lensModel": "NIKKOR Z 20mm f/1.8 S",
    "flash": false,
    "focalLength": 20.0,
    "apertureValue": 1.8,
    "isoSpeedRatings": 22800,
    "exposureTime": 0.00625,
    "creator": "Aleksandr Kadykov",
    "copyright": "Creative Commons Attribution (CC BY)"
  },
  {
    "relativePath": "2025/05/17/DSC_5322.jpg",
    "filename": "DSC_5322.jpg",
    "year": 2025,
    "month": 5,
    "day": 17,
    "slug": "2025-05-17-DSC_5322",
    "width": 5585,
    "height": 3961,
    "dateTaken": "2025-05-17T21:43:20",
    "title": "",
    "description": null,
    "tags": [
      "brussels",
      "event",
      "lgbt",
      "pride"
    ],
    "cameraModel": "NIKON Z 6_2",
    "lensModel": "NIKKOR Z 20mm f/1.8 S",
    "flash": false,
    "focalLength": 20.0,
    "apertureValue": 1.8,
    "isoSpeedRatings": 5600,
    "exposureTime": 0.005,
    "creator": "Aleksandr Kadykov",
    "copyright": "Creative Commons Attribution (CC BY)"
  },
  {
    "relativePath": "2025/05/17/GR009244.jpg",
    "filename": "GR009244.jpg",
    "year": 2025,
    "month": 5,
    "day": 17,
    "slug": "2025-05-17-GR009244",
    "width": 3611,
    "height": 6000,
    "dateTaken": "2025-05-17T15:52:05",
    "title": "",
    "description": null,
    "tags": [
      "belgium",
      "brussels",
      "event",
      "lgbt",
      "pride"
    ],
    "cameraModel": "RICOH GR III",
    "lensModel": null,
    "flash": false,
    "focalLength": 13.8,
    "apertureValue": 2.8,
    "isoSpeedRatings": 100,
    "exposureTime": 0.000625,
    "creator": "Aleksandr Kadykov",
    "copyright": "Creative Commons Attribution (CC BY)"
  },
  {
    "relativePath": "2025/05/17/GR009243.jpg",
    "filename": "GR009243.jpg",
    "year": 2025,
    "month": 5,
    "day": 17,
    "slug": "2025-05-17-GR009243",
    "width": 3195,
    "height": 5288,
    "dateTaken": "2025-05-17T15:52:03",
    "title": "",
    "description": null,
    "tags": [
      "belgium",
      "brussels",
      "event",
      "lgbt",
      "pride"
    ],
    "cameraModel": "RICOH GR III",
    "lensModel": null,
    "flash": true,
    "focalLength": 13.8,
    "apertureValue": 2.8,
    "isoSpeedRatings": 100,
    "exposureTime": 0.000625,
    "creator": "Aleksandr Kadykov",
    "copyright": "Creative Commons Attribution (CC BY)"
  },
  {
    "relativePath": "2025/05/17/GR002083.avif",
    "filename": "GR002083.avif",
    "year": 2025,
    "month": 5,
    "day": 17,
    "slug": "2025-05-17-GR002083",
    "width": 5683,
    "height": 3825,
    "dateTaken": "2023-06-04T12:32:58",
    "title": "Saint George arrives on the Grande Place for the combat",
    "description": "",
    "tags": [
      "belgium",
      "doudou",
      "event",
      "mons"
    ],
    "cameraModel": "RICOH GR III",
    "lensModel": null,
    "flash": true,
    "focalLength": 18.3,
    "apertureValue": 4.0,
    "isoSpeedRatings": 100,
    "exposureTime": 0.001,
    "creator": "Aleksandr Kadykov",
    "copyright": "Creative Commons Attribution (CC BY)"
  }
]